Title,Summary,Published Date,Authors,PDF Link
"Large Language Models for Biomedical Knowledge Graph Construction:
  Information extraction from EMR notes","  The automatic construction of knowledge graphs (KGs) is an important research
area in medicine, with far-reaching applications spanning drug discovery and
clinical trial design. These applications hinge on the accurate identification
of interactions among medical and biological entities. In this study, we
propose an end-to-end machine learning solution based on large language models
(LLMs) that utilize electronic medical record notes to construct KGs. The
entities used in the KG construction process are diseases, factors, treatments,
as well as manifestations that coexist with the patient while experiencing the
disease. Given the critical need for high-quality performance in medical
applications, we embark on a comprehensive assessment of 12 LLMs of various
architectures, evaluating their performance and safety attributes. To gauge the
quantitative efficacy of our approach by assessing both precision and recall,
we manually annotate a dataset provided by the Macula and Retina Institute. We
also assess the qualitative performance of LLMs, such as the ability to
generate structured outputs or the tendency to hallucinate. The results
illustrate that in contrast to encoder-only and encoder-decoder, decoder-only
LLMs require further investigation. Additionally, we provide guided prompt
design to utilize such LLMs. The application of the proposed methodology is
demonstrated on age-related macular degeneration.
",2023-01-29T15:52:33Z,"Vahan Arsenyan, Spartak Bughdaryan, Fadi Shaya, Kent Small, Davit Shahnazaryan",http://arxiv.org/pdf/2301.12473v2
"Leveraging Medical Knowledge Graphs Into Large Language Models for
  Diagnosis Prediction: Design and Application Study","  Electronic Health Records (EHRs) and routine documentation practices play a
vital role in patients' daily care, providing a holistic record of health,
diagnoses, and treatment. However, complex and verbose EHR narratives overload
healthcare providers, risking diagnostic inaccuracies. While Large Language
Models (LLMs) have showcased their potential in diverse language tasks, their
application in the healthcare arena needs to ensure the minimization of
diagnostic errors and the prevention of patient harm. In this paper, we outline
an innovative approach for augmenting the proficiency of LLMs in the realm of
automated diagnosis generation, achieved through the incorporation of a medical
knowledge graph (KG) and a novel graph model: Dr.Knows, inspired by the
clinical diagnostic reasoning process. We derive the KG from the National
Library of Medicine's Unified Medical Language System (UMLS), a robust
repository of biomedical knowledge. Our method negates the need for
pre-training and instead leverages the KG as an auxiliary instrument aiding in
the interpretation and summarization of complex medical concepts. Using
real-world hospital datasets, our experimental results demonstrate that the
proposed approach of combining LLMs with KG has the potential to improve the
accuracy of automated diagnosis generation. More importantly, our approach
offers an explainable diagnostic pathway, edging us closer to the realization
of AI-augmented diagnostic decision support systems.
",2023-08-28T06:05:18Z,"Yanjun Gao, Ruizhe Li, Emma Croxford, John Caskey, Brian W Patterson, Matthew Churpek, Timothy Miller, Dmitriy Dligach, Majid Afshar",http://arxiv.org/pdf/2308.14321v2
"CMQCIC-Bench: A Chinese Benchmark for Evaluating Large Language Models
  in Medical Quality Control Indicator Calculation","  Medical quality control indicators are essential to assess the qualifications
of healthcare institutions for medical services. With the impressive
performance of large language models (LLMs) like GPT-4 in the medical field,
leveraging these technologies for the Medical Quality Control Indicator
Calculation (MQCIC) presents a promising approach. In this work, (1) we
introduce a real-world task MQCIC and propose an open-source Chinese electronic
medical records (EMRs)-based dataset (CMQCIC-Bench) comprising 785 instances
and 76 indicators. (2) We propose a semi-automatic method to enhance the rule
representation. Then we propose the Clinical Facts-based Inferential Rule
(CF-IR) method that disentangles the clinical fact verification and inferential
rule reasoning actions. (3) We conduct comprehensive experiments on 20
representative LLMs, covering general and medical models. Our findings reveal
that CF-IR outperforms Chain-of-Thought methods in MQCIC tasks. (4) We conduct
an error analysis and investigate the capabilities of clinical fact
verification and inferential rule reasoning, providing insights to improve
performance in the MQCIC further. The dataset and code is available in this
repo https://anonymous.4open.science/r/C-MQCIC-1151.
",2025-02-17T11:40:48Z,"Guangya Yu, Yanhao Li, Zongying Jiang, Yuxiong Jin, Li Dai, Yupian Lin, Ruihui Hou, Weiyan Zhang, Yongqi Fan, Qi Ye, Jingping Liu, Tong Ruan",http://arxiv.org/pdf/2502.11703v1
"Onco-Retriever: Generative Classifier for Retrieval of EHR Records in
  Oncology","  Retrieving information from EHR systems is essential for answering specific
questions about patient journeys and improving the delivery of clinical care.
Despite this fact, most EHR systems still rely on keyword-based searches. With
the advent of generative large language models (LLMs), retrieving information
can lead to better search and summarization capabilities. Such retrievers can
also feed Retrieval-augmented generation (RAG) pipelines to answer any query.
However, the task of retrieving information from EHR real-world clinical data
contained within EHR systems in order to solve several downstream use cases is
challenging due to the difficulty in creating query-document support pairs. We
provide a blueprint for creating such datasets in an affordable manner using
large language models. Our method results in a retriever that is 30-50 F-1
points better than propriety counterparts such as Ada and Mistral for oncology
data elements. We further compare our model, called Onco-Retriever, against
fine-tuned PubMedBERT model as well. We conduct an extensive manual evaluation
on real-world EHR data along with latency analysis of the different models and
provide a path forward for healthcare organizations to build domain-specific
retrievers.
",2024-04-10T02:02:34Z,"Shashi Kant Gupta, Aditya Basu, Bradley Taylor, Anai Kothari, Hrituraj Singh",http://arxiv.org/pdf/2404.06680v1
"KG-MTT-BERT: Knowledge Graph Enhanced BERT for Multi-Type Medical Text
  Classification","  Medical text learning has recently emerged as a promising area to improve
healthcare due to the wide adoption of electronic health record (EHR) systems.
The complexity of the medical text such as diverse length, mixed text types,
and full of medical jargon, poses a great challenge for developing effective
deep learning models. BERT has presented state-of-the-art results in many NLP
tasks, such as text classification and question answering. However, the
standalone BERT model cannot deal with the complexity of the medical text,
especially the lengthy clinical notes. Herein, we develop a new model called
KG-MTT-BERT (Knowledge Graph Enhanced Multi-Type Text BERT) by extending the
BERT model for long and multi-type text with the integration of the medical
knowledge graph. Our model can outperform all baselines and other
state-of-the-art models in diagnosis-related group (DRG) classification, which
requires comprehensive medical text for accurate classification. We also
demonstrated that our model can effectively handle multi-type text and the
integration of medical knowledge graph can significantly improve the
performance.
",2022-10-08T08:37:44Z,"Yong He, Cheng Wang, Shun Zhang, Nan Li, Zhaorong Li, Zhenyu Zeng",http://arxiv.org/pdf/2210.03970v1
"SPeC: A Soft Prompt-Based Calibration on Performance Variability of
  Large Language Model in Clinical Notes Summarization","  Electronic health records (EHRs) store an extensive array of patient
information, encompassing medical histories, diagnoses, treatments, and test
outcomes. These records are crucial for enabling healthcare providers to make
well-informed decisions regarding patient care. Summarizing clinical notes
further assists healthcare professionals in pinpointing potential health risks
and making better-informed decisions. This process contributes to reducing
errors and enhancing patient outcomes by ensuring providers have access to the
most pertinent and current patient data. Recent research has shown that
incorporating prompts with large language models (LLMs) substantially boosts
the efficacy of summarization tasks. However, we show that this approach also
leads to increased output variance, resulting in notably divergent outputs even
when prompts share similar meanings. To tackle this challenge, we introduce a
model-agnostic Soft Prompt-Based Calibration (SPeC) pipeline that employs soft
prompts to diminish variance while preserving the advantages of prompt-based
summarization. Experimental findings on multiple clinical note tasks and LLMs
indicate that our method not only bolsters performance but also effectively
curbs variance for various LLMs, providing a more uniform and dependable
solution for summarizing vital medical information.
",2023-03-23T04:47:46Z,"Yu-Neng Chuang, Ruixiang Tang, Xiaoqian Jiang, Xia Hu",http://arxiv.org/pdf/2303.13035v3
"Towards Reliable Medical Question Answering: Techniques and Challenges
  in Mitigating Hallucinations in Language Models","  The rapid advancement of large language models (LLMs) has significantly
impacted various domains, including healthcare and biomedicine. However, the
phenomenon of hallucination, where LLMs generate outputs that deviate from
factual accuracy or context, poses a critical challenge, especially in
high-stakes domains. This paper conducts a scoping study of existing techniques
for mitigating hallucinations in knowledge-based task in general and especially
for medical domains. Key methods covered in the paper include
Retrieval-Augmented Generation (RAG)-based techniques, iterative feedback
loops, supervised fine-tuning, and prompt engineering. These techniques, while
promising in general contexts, require further adaptation and optimization for
the medical domain due to its unique demands for up-to-date, specialized
knowledge and strict adherence to medical guidelines. Addressing these
challenges is crucial for developing trustworthy AI systems that enhance
clinical decision-making and patient safety as well as accuracy of biomedical
scientific research.
",2024-08-25T11:09:15Z,"Duy Khoa Pham, Bao Quoc Vo",http://arxiv.org/pdf/2408.13808v1
"FIND: Fine-grained Information Density Guided Adaptive
  Retrieval-Augmented Generation for Disease Diagnosis","  Retrieval-Augmented Large Language Models (LLMs), which integrate external
knowledge into LLMs, have shown remarkable performance in various medical
domains, including clinical diagnosis. However, existing RAG methods struggle
to effectively assess task difficulty to make retrieval decisions, thereby
failing to meet the clinical requirements for balancing efficiency and
accuracy. So in this paper, we propose FIND (\textbf{F}ine-grained
\textbf{In}formation \textbf{D}ensity Guided Adaptive RAG), a novel framework
that improves the reliability of RAG in disease diagnosis scenarios. FIND
incorporates a fine-grained adaptive control module to determine whether
retrieval is necessary based on the information density of the input. By
optimizing the retrieval process and implementing a knowledge filtering module,
FIND ensures that the retrieval is better suited to clinical scenarios.
Experiments on three Chinese electronic medical record datasets demonstrate
that FIND significantly outperforms various baseline methods, highlighting its
effectiveness in clinical diagnosis tasks.
",2025-02-20T14:52:36Z,"Mingyi Jia, Junwen Duan, Yan Song, Jianxin Wang",http://arxiv.org/pdf/2502.14614v1
"Open-Source Retrieval Augmented Generation Framework for Retrieving
  Accurate Medication Insights from Formularies for African Healthcare Workers","  Accessing accurate medication insights is vital for enhancing patient safety,
minimizing errors, and supporting clinical decision-making. However, healthcare
professionals in Africa often rely on manual and time-consuming processes to
retrieve drug information, exacerbated by limited access to pharmacists due to
brain drain and healthcare disparities. This paper presents ""Drug Insights,"" an
open-source Retrieval-Augmented Generation (RAG) chatbot designed to streamline
medication lookup for healthcare workers in Africa. By leveraging a corpus of
Nigerian pharmaceutical data and advanced AI technologies, including Pinecone
databases and GPT models, the system delivers accurate, context-specific
responses with minimal hallucination. The chatbot integrates prompt engineering
and S-BERT evaluation to optimize retrieval and response generation.
Preliminary tests, including pharmacist feedback, affirm the tool's potential
to improve drug information access while highlighting areas for enhancement,
such as UI/UX refinement and extended corpus integration.
",2025-01-28T02:18:26Z,"Axum AI,  :, J. Owoyemi, S. Abubakar, A. Owoyemi, T. O. Togunwa, F. C. Madubuko, S. Oyatoye, Z. Oyetolu, K. Akyea, A. O. Mohammed, A. Adebakin",http://arxiv.org/pdf/2502.15722v1
Ontology-Constrained Generation of Domain-Specific Clinical Summaries,"  Large Language Models (LLMs) offer promising solutions for text
summarization. However, some domains require specific information to be
available in the summaries. Generating these domain-adapted summaries is still
an open challenge. Similarly, hallucinations in generated content is a major
drawback of current approaches, preventing their deployment. This study
proposes a novel approach that leverages ontologies to create domain-adapted
summaries both structured and unstructured. We employ an ontology-guided
constrained decoding process to reduce hallucinations while improving
relevance. When applied to the medical domain, our method shows potential in
summarizing Electronic Health Records (EHRs) across different specialties,
allowing doctors to focus on the most relevant information to their domain.
Evaluation on the MIMIC-III dataset demonstrates improvements in generating
domain-adapted summaries of clinical notes and hallucination reduction.
",2024-11-23T23:05:48Z,"Gaya Mehenni, Amal Zouaq",http://arxiv.org/pdf/2411.15666v1
A Large Language Model Pipeline for Breast Cancer Oncology,"  Large language models (LLMs) have demonstrated potential in the innovation of
many disciplines. However, how they can best be developed for oncology remains
underdeveloped. State-of-the-art OpenAI models were fine-tuned on a clinical
dataset and clinical guidelines text corpus for two important cancer treatment
factors, adjuvant radiation therapy and chemotherapy, using a novel Langchain
prompt engineering pipeline. A high accuracy (0.85+) was achieved in the
classification of adjuvant radiation therapy and chemotherapy for breast cancer
patients. Furthermore, a confidence interval was formed from observational data
on the quality of treatment from human oncologists to estimate the proportion
of scenarios in which the model must outperform the original oncologist in its
treatment prediction to be a better solution overall as 8.2% to 13.3%. Due to
indeterminacy in the outcomes of cancer treatment decisions, future
investigation, potentially a clinical trial, would be required to determine if
this threshold was met by the models. Nevertheless, with 85% of U.S. cancer
patients receiving treatment at local community facilities, these kinds of
models could play an important part in expanding access to quality care with
outcomes that lie, at minimum, close to a human oncologist.
",2024-06-10T16:44:48Z,"Tristen Pool, Dennis Trujillo",http://arxiv.org/pdf/2406.06455v2
"MedCT: A Clinical Terminology Graph for Generative AI Applications in
  Healthcare","  We introduce the world's first clinical terminology for the Chinese
healthcare community, namely MedCT, accompanied by a clinical foundation model
MedBERT and an entity linking model MedLink. The MedCT system enables
standardized and programmable representation of Chinese clinical data,
successively stimulating the development of new medicines, treatment pathways,
and better patient outcomes for the populous Chinese community. Moreover, the
MedCT knowledge graph provides a principled mechanism to minimize the
hallucination problem of large language models (LLMs), therefore achieving
significant levels of accuracy and safety in LLM-based clinical applications.
By leveraging the LLMs' emergent capabilities of generativeness and
expressiveness, we were able to rapidly built a production-quality terminology
system and deployed to real-world clinical field within three months, while
classical terminologies like SNOMED CT have gone through more than twenty years
development. Our experiments show that the MedCT system achieves
state-of-the-art (SOTA) performance in semantic matching and entity linking
tasks, not only for Chinese but also for English. We also conducted a
longitudinal field experiment by applying MedCT and LLMs in a representative
spectrum of clinical tasks, including electronic health record (EHR)
auto-generation and medical document search for diagnostic decision making. Our
study shows a multitude of values of MedCT for clinical workflows and patient
outcomes, especially in the new genre of clinical LLM applications. We present
our approach in sufficient engineering detail, such that implementing a
clinical terminology for other non-English societies should be readily
reproducible. We openly release our terminology, models and algorithms, along
with real-world clinical datasets for the development.
",2025-01-11T07:35:51Z,"Ye Chen, Dongdong Huang, Haoyun Xu, Cong Fu, Lin Sheng, Qingli Zhou, Yuqiang Shen, Kai Wang",http://arxiv.org/pdf/2501.06465v2
Utilizing ChatGPT to Enhance Clinical Trial Enrollment,"  Clinical trials are a critical component of evaluating the effectiveness of
new medical interventions and driving advancements in medical research.
Therefore, timely enrollment of patients is crucial to prevent delays or
premature termination of trials. In this context, Electronic Health Records
(EHRs) have emerged as a valuable tool for identifying and enrolling eligible
participants. In this study, we propose an automated approach that leverages
ChatGPT, a large language model, to extract patient-related information from
unstructured clinical notes and generate search queries for retrieving
potentially eligible clinical trials. Our empirical evaluation, conducted on
two benchmark retrieval collections, shows improved retrieval performance
compared to existing approaches when several general-purposed and task-specific
prompts are used. Notably, ChatGPT-generated queries also outperform
human-generated queries in terms of retrieval performance. These findings
highlight the potential use of ChatGPT to enhance clinical trial enrollment
while ensuring the quality of medical service and minimizing direct risks to
patients.
",2023-06-03T10:54:23Z,"Georgios Peikos, Symeon Symeonidis, Pranav Kasela, Gabriella Pasi",http://arxiv.org/pdf/2306.02077v1
RuCCoD: Towards Automated ICD Coding in Russian,"  This study investigates the feasibility of automating clinical coding in
Russian, a language with limited biomedical resources. We present a new dataset
for ICD coding, which includes diagnosis fields from electronic health records
(EHRs) annotated with over 10,000 entities and more than 1,500 unique ICD
codes. This dataset serves as a benchmark for several state-of-the-art models,
including BERT, LLaMA with LoRA, and RAG, with additional experiments examining
transfer learning across domains (from PubMed abstracts to medical diagnosis)
and terminologies (from UMLS concepts to ICD codes). We then apply the
best-performing model to label an in-house EHR dataset containing patient
histories from 2017 to 2021. Our experiments, conducted on a carefully curated
test set, demonstrate that training with the automated predicted codes leads to
a significant improvement in accuracy compared to manually annotated data from
physicians. We believe our findings offer valuable insights into the potential
for automating clinical coding in resource-limited languages like Russian,
which could enhance clinical efficiency and data accuracy in these contexts.
",2025-02-28T17:40:24Z,"Aleksandr Nesterov, Andrey Sakhovskiy, Ivan Sviridov, Airat Valiev, Vladimir Makharev, Petr Anokhin, Galina Zubkova, Elena Tutubalina",http://arxiv.org/pdf/2502.21263v1
"Assessing the Usability of GutGPT: A Simulation Study of an AI Clinical
  Decision Support System for Gastrointestinal Bleeding Risk","  Applications of large language models (LLMs) like ChatGPT have potential to
enhance clinical decision support through conversational interfaces. However,
challenges of human-algorithmic interaction and clinician trust are poorly
understood. GutGPT, a LLM for gastrointestinal (GI) bleeding risk prediction
and management guidance, was deployed in clinical simulation scenarios
alongside the electronic health record (EHR) with emergency medicine
physicians, internal medicine physicians, and medical students to evaluate its
effect on physician acceptance and trust in AI clinical decision support
systems (AI-CDSS). GutGPT provides risk predictions from a validated machine
learning model and evidence-based answers by querying extracted clinical
guidelines. Participants were randomized to GutGPT and an interactive
dashboard, or the interactive dashboard and a search engine. Surveys and
educational assessments taken before and after measured technology acceptance
and content mastery. Preliminary results showed mixed effects on acceptance
after using GutGPT compared to the dashboard or search engine but appeared to
improve content mastery based on simulation performance. Overall, this study
demonstrates LLMs like GutGPT could enhance effective AI-CDSS if implemented
optimally and paired with interactive interfaces.
",2023-12-06T23:20:03Z,"Colleen Chan, Kisung You, Sunny Chung, Mauro Giuffrè, Theo Saarinen, Niroop Rajashekar, Yuan Pu, Yeo Eun Shin, Loren Laine, Ambrose Wong, René Kizilcec, Jasjeet Sekhon, Dennis Shung",http://arxiv.org/pdf/2312.10072v1
"Large Language Models for Medical OSCE Assessment: A Novel Approach to
  Transcript Analysis","  Grading Objective Structured Clinical Examinations (OSCEs) is a
time-consuming and expensive process, traditionally requiring extensive manual
effort from human experts. In this study, we explore the potential of Large
Language Models (LLMs) to assess skills related to medical student
communication. We analyzed 2,027 video-recorded OSCE examinations from the
University of Texas Southwestern Medical Center (UTSW), spanning four years
(2019-2022), and several different medical cases or ""stations."" Specifically,
our focus was on evaluating students' ability to summarize patients' medical
history: we targeted the rubric item 'did the student summarize the patients'
medical history?' from the communication skills rubric. After transcribing
speech audio captured by OSCE videos using Whisper-v3, we studied the
performance of various LLM-based approaches for grading students on this
summarization task based on their examination transcripts. Using various
frontier-level open-source and proprietary LLMs, we evaluated different
techniques such as zero-shot chain-of-thought prompting, retrieval augmented
generation, and multi-model ensemble methods. Our results show that frontier
LLM models like GPT-4 achieved remarkable alignment with human graders,
demonstrating a Cohen's kappa agreement of 0.88 and indicating strong potential
for LLM-based OSCE grading to augment the current grading process. Open-source
models also showed promising results, suggesting potential for widespread,
cost-effective deployment. Further, we present a failure analysis identifying
conditions where LLM grading may be less reliable in this context and recommend
best practices for deploying LLMs in medical education settings.
",2024-10-11T19:16:03Z,"Ameer Hamza Shakur, Michael J. Holcomb, David Hein, Shinyoung Kang, Thomas O. Dalton, Krystle K. Campbell, Daniel J. Scott, Andrew R. Jamieson",http://arxiv.org/pdf/2410.12858v1
