Title,Summary,Published Date,Authors,PDF Link
"Evaluating Large Language Models on a Highly-specialized Topic,
  Radiation Oncology Physics","  We present the first study to investigate Large Language Models (LLMs) in
answering radiation oncology physics questions. Because popular exams like AP
Physics, LSAT, and GRE have large test-taker populations and ample test
preparation resources in circulation, they may not allow for accurately
assessing the true potential of LLMs. This paper proposes evaluating LLMs on a
highly-specialized topic, radiation oncology physics, which may be more
pertinent to scientific and medical communities in addition to being a valuable
benchmark of LLMs. We developed an exam consisting of 100 radiation oncology
physics questions based on our expertise at Mayo Clinic. Four LLMs, ChatGPT
(GPT-3.5), ChatGPT (GPT-4), Bard (LaMDA), and BLOOMZ, were evaluated against
medical physicists and non-experts. ChatGPT (GPT-4) outperformed all other LLMs
as well as medical physicists, on average. The performance of ChatGPT (GPT-4)
was further improved when prompted to explain first, then answer. ChatGPT
(GPT-3.5 and GPT-4) showed a high level of consistency in its answer choices
across a number of trials, whether correct or incorrect, a characteristic that
was not observed in the human test groups. In evaluating ChatGPTs (GPT-4)
deductive reasoning ability using a novel approach (substituting the correct
answer with ""None of the above choices is the correct answer.""), ChatGPT
(GPT-4) demonstrated surprising accuracy, suggesting the potential presence of
an emergent ability. Finally, although ChatGPT (GPT-4) performed well overall,
its intrinsic properties did not allow for further improvement when scoring
based on a majority vote across trials. In contrast, a team of medical
physicists were able to greatly outperform ChatGPT (GPT-4) using a majority
vote. This study suggests a great potential for LLMs to work alongside
radiation oncology experts as highly knowledgeable assistants.
",2023-04-01T06:04:58Z,"Jason Holmes, Zhengliang Liu, Lian Zhang, Yuzhen Ding, Terence T. Sio, Lisa A. McGee, Jonathan B. Ashman, Xiang Li, Tianming Liu, Jiajian Shen, Wei Liu",http://arxiv.org/pdf/2304.01938v1
CohortGPT: An Enhanced GPT for Participant Recruitment in Clinical Study,"  Participant recruitment based on unstructured medical texts such as clinical
notes and radiology reports has been a challenging yet important task for the
cohort establishment in clinical research. Recently, Large Language Models
(LLMs) such as ChatGPT have achieved tremendous success in various downstream
tasks thanks to their promising performance in language understanding,
inference, and generation. It is then natural to test their feasibility in
solving the cohort recruitment task, which involves the classification of a
given paragraph of medical text into disease label(s). However, when applied to
knowledge-intensive problem settings such as medical text classification, where
the LLMs are expected to understand the decision made by human experts and
accurately identify the implied disease labels, the LLMs show a mediocre
performance. A possible explanation is that, by only using the medical text,
the LLMs neglect to use the rich context of additional information that
languages afford. To this end, we propose to use a knowledge graph as auxiliary
information to guide the LLMs in making predictions. Moreover, to further boost
the LLMs adapt to the problem setting, we apply a chain-of-thought (CoT) sample
selection strategy enhanced by reinforcement learning, which selects a set of
CoT samples given each individual medical report. Experimental results and
various ablation studies show that our few-shot learning method achieves
satisfactory performance compared with fine-tuning strategies and gains superb
advantages when the available data is limited. The code and sample dataset of
the proposed CohortGPT model is available at:
https://anonymous.4open.science/r/CohortGPT-4872/
",2023-07-21T04:43:00Z,"Zihan Guan, Zihao Wu, Zhengliang Liu, Dufan Wu, Hui Ren, Quanzheng Li, Xiang Li, Ninghao Liu",http://arxiv.org/pdf/2307.11346v1
"The Power of Combining Data and Knowledge: GPT-4o is an Effective
  Interpreter of Machine Learning Models in Predicting Lymph Node Metastasis of
  Lung Cancer","  Lymph node metastasis (LNM) is a crucial factor in determining the initial
treatment for patients with lung cancer, yet accurate preoperative diagnosis of
LNM remains challenging. Recently, large language models (LLMs) have garnered
significant attention due to their remarkable text generation capabilities.
Leveraging the extensive medical knowledge learned from vast corpora, LLMs can
estimate probabilities for clinical problems, though their performance has
historically been inferior to data-driven machine learning models. In this
paper, we propose a novel ensemble method that combines the medical knowledge
acquired by LLMs with the latent patterns identified by machine learning models
to enhance LNM prediction performance. Initially, we developed machine learning
models using patient data. We then designed a prompt template to integrate the
patient data with the predicted probability from the machine learning model.
Subsequently, we instructed GPT-4o, the most advanced LLM developed by OpenAI,
to estimate the likelihood of LNM based on patient data and then adjust the
estimate using the machine learning output. Finally, we collected three outputs
from the GPT-4o using the same prompt and ensembled these results as the final
prediction. Using the proposed method, our models achieved an AUC value of
0.778 and an AP value of 0.426 for LNM prediction, significantly improving
predictive performance compared to baseline machine learning models. The
experimental results indicate that GPT-4o can effectively leverage its medical
knowledge and the probabilities predicted by machine learning models to achieve
more accurate LNM predictions. These findings demonstrate that LLMs can perform
well in clinical risk prediction tasks, offering a new paradigm for integrating
medical knowledge and patient data in clinical predictions.
",2024-07-25T09:42:24Z,"Danqing Hu, Bing Liu, Xiaofeng Zhu, Nan Wu",http://arxiv.org/pdf/2407.17900v5
LLMs in Biomedicine: A study on clinical Named Entity Recognition,"  Large Language Models (LLMs) demonstrate remarkable versatility in various
NLP tasks but encounter distinct challenges in biomedical due to the
complexities of language and data scarcity. This paper investigates LLMs
application in the biomedical domain by exploring strategies to enhance their
performance for the NER task. Our study reveals the importance of meticulously
designed prompts in the biomedical. Strategic selection of in-context examples
yields a marked improvement, offering ~15-20\% increase in F1 score across all
benchmark datasets for biomedical few-shot NER. Additionally, our results
indicate that integrating external biomedical knowledge via prompting
strategies can enhance the proficiency of general-purpose LLMs to meet the
specialized needs of biomedical NER. Leveraging a medical knowledge base, our
proposed method, DiRAG, inspired by Retrieval-Augmented Generation (RAG), can
boost the zero-shot F1 score of LLMs for biomedical NER. Code is released at
\url{https://github.com/masoud-monajati/LLM_Bio_NER}
",2024-04-10T22:26:26Z,"Masoud Monajatipoor, Jiaxin Yang, Joel Stremmel, Melika Emami, Fazlolah Mohaghegh, Mozhdeh Rouhsedaghat, Kai-Wei Chang",http://arxiv.org/pdf/2404.07376v2
SM70: A Large Language Model for Medical Devices,"  We are introducing SM70, a 70 billion-parameter Large Language Model that is
specifically designed for SpassMed's medical devices under the brand name
'JEE1' (pronounced as G1 and means 'Life'). This large language model provides
more accurate and safe responses to medical-domain questions. To fine-tune
SM70, we used around 800K data entries from the publicly available dataset
MedAlpaca. The Llama2 70B open-sourced model served as the foundation for SM70,
and we employed the QLoRA technique for fine-tuning. The evaluation is
conducted across three benchmark datasets - MEDQA - USMLE, PUBMEDQA, and USMLE
- each representing a unique aspect of medical knowledge and reasoning. The
performance of SM70 is contrasted with other notable LLMs, including Llama2
70B, Clinical Camel 70 (CC70), GPT 3.5, GPT 4, and Med-Palm, to provide a
comparative understanding of its capabilities within the medical domain. Our
results indicate that SM70 outperforms several established models in these
datasets, showcasing its proficiency in handling a range of medical queries,
from fact-based questions derived from PubMed abstracts to complex clinical
decision-making scenarios. The robust performance of SM70, particularly in the
USMLE and PUBMEDQA datasets, suggests its potential as an effective tool in
clinical decision support and medical information retrieval. Despite its
promising results, the paper also acknowledges the areas where SM70 lags behind
the most advanced model, GPT 4, thereby highlighting the need for further
development, especially in tasks demanding extensive medical knowledge and
intricate reasoning.
",2023-12-12T04:25:26Z,"Anubhav Bhatti, Surajsinh Parmar, San Lee",http://arxiv.org/pdf/2312.06974v1
"Benchmarking Generative AI for Scoring Medical Student Interviews in
  Objective Structured Clinical Examinations (OSCEs)","  Introduction. Objective Structured Clinical Examinations (OSCEs) are widely
used to assess medical students' communication skills, but scoring
interview-based assessments is time-consuming and potentially subject to human
bias. This study explored the potential of large language models (LLMs) to
automate OSCE evaluations using the Master Interview Rating Scale (MIRS).
  Methods. We compared the performance of four state-of-the-art LLMs (GPT-4o,
Claude 3.5, Llama 3.1, and Gemini 1.5 Pro) in evaluating OSCE transcripts
across all 28 items of the MIRS under the conditions of zero-shot,
chain-of-thought (CoT), few-shot, and multi-step prompting. The models were
benchmarked against a dataset of 10 OSCE cases with 174 expert consensus scores
available. Model performance was measured using three accuracy metrics (exact,
off-by-one, thresholded).
  Results. Averaging across all MIRS items and OSCE cases, LLMs performed with
low exact accuracy (0.27 to 0.44), and moderate to high off-by-one accuracy
(0.67 to 0.87) and thresholded accuracy (0.75 to 0.88). A zero temperature
parameter ensured high intra-rater reliability ($\alpha = 0.98$ for GPT-4o).
CoT, few-shot, and multi-step techniques proved valuable when tailored to
specific assessment items. The performance was consistent across MIRS items
independent of encounter phases and communication domains.
  Conclusion. We demonstrated the feasibility of AI-assisted OSCE evaluation
and provided benchmarking of multiple LLMs across multiple prompt techniques.
Our work provides a baseline performance assessment for LLMs that lays a
foundation for future research in automated assessment of clinical
communication skills.
",2025-01-21T04:05:45Z,"Jadon Geathers, Yann Hicke, Colleen Chan, Niroop Rajashekar, Justin Sewell, Susannah Cornes, Rene Kizilcec, Dennis Shung",http://arxiv.org/pdf/2501.13957v1
"Evaluating and Enhancing Large Language Models Performance in
  Domain-specific Medicine: Osteoarthritis Management with DocOA","  The efficacy of large language models (LLMs) in domain-specific medicine,
particularly for managing complex diseases such as osteoarthritis (OA), remains
largely unexplored. This study focused on evaluating and enhancing the clinical
capabilities of LLMs in specific domains, using osteoarthritis (OA) management
as a case study. A domain specific benchmark framework was developed, which
evaluate LLMs across a spectrum from domain-specific knowledge to clinical
applications in real-world clinical scenarios. DocOA, a specialized LLM
tailored for OA management that integrates retrieval-augmented generation (RAG)
and instruction prompts, was developed. The study compared the performance of
GPT-3.5, GPT-4, and a specialized assistant, DocOA, using objective and human
evaluations. Results showed that general LLMs like GPT-3.5 and GPT-4 were less
effective in the specialized domain of OA management, particularly in providing
personalized treatment recommendations. However, DocOA showed significant
improvements. This study introduces a novel benchmark framework which assesses
the domain-specific abilities of LLMs in multiple aspects, highlights the
limitations of generalized LLMs in clinical contexts, and demonstrates the
potential of tailored approaches for developing domain-specific medical LLMs.
",2024-01-20T03:41:23Z,"Xi Chen, MingKe You, Li Wang, WeiZhi Liu, Yu Fu, Jie Xu, Shaoting Zhang, Gang Chen, Kang Li, Jian Li",http://arxiv.org/pdf/2401.12998v1
"Fine-Tuning a Local LLaMA-3 Large Language Model for Automated
  Privacy-Preserving Physician Letter Generation in Radiation Oncology","  Generating physician letters is a time-consuming task in daily clinical
practice. This study investigates local fine-tuning of large language models
(LLMs), specifically LLaMA models, for physician letter generation in a
privacy-preserving manner within the field of radiation oncology. Our findings
demonstrate that base LLaMA models, without fine-tuning, are inadequate for
effectively generating physician letters. The QLoRA algorithm provides an
efficient method for local intra-institutional fine-tuning of LLMs with limited
computational resources (i.e., a single 48 GB GPU workstation within the
hospital). The fine-tuned LLM successfully learns radiation oncology-specific
information and generates physician letters in an institution-specific style.
ROUGE scores of the generated summary reports highlight the superiority of the
8B LLaMA-3 model over the 13B LLaMA-2 model. Further multidimensional physician
evaluations of 10 cases reveal that, although the fine-tuned LLaMA-3 model has
limited capacity to generate content beyond the provided input data, it
successfully generates salutations, diagnoses and treatment histories,
recommendations for further treatment, and planned schedules. Overall, clinical
benefit was rated highly by the clinical experts (average score of 3.44 on a
4-point scale). With careful physician review and correction, automated
LLM-based physician letter generation has significant practical value.
",2024-08-20T10:31:36Z,"Yihao Hou, Christoph Bert, Ahmed Gomaa, Godehard Lahmer, Daniel Hoefler, Thomas Weissmann, Raphaela Voigt, Philipp Schubert, Charlotte Schmitter, Alina Depardon, Sabine Semrau, Andreas Maier, Rainer Fietkau, Yixing Huang, Florian Putz",http://arxiv.org/pdf/2408.10715v1
"DKEC: Domain Knowledge Enhanced Multi-Label Classification for Diagnosis
  Prediction","  Multi-label text classification (MLTC) tasks in the medical domain often face
the long-tail label distribution problem. Prior works have explored
hierarchical label structures to find relevant information for few-shot
classes, but mostly neglected to incorporate external knowledge from medical
guidelines. This paper presents DKEC, Domain Knowledge Enhanced Classification
for diagnosis prediction with two innovations: (1) automated construction of
heterogeneous knowledge graphs from external sources to capture semantic
relations among diverse medical entities, (2) incorporating the heterogeneous
knowledge graphs in few-shot classification using a label-wise attention
mechanism. We construct DKEC using three online medical knowledge sources and
evaluate it on a real-world Emergency Medical Services (EMS) dataset and a
public electronic health record (EHR) dataset. Results show that DKEC
outperforms the state-of-the-art label-wise attention networks and transformer
models of different sizes, particularly for the few-shot classes. More
importantly, it helps the smaller language models achieve comparable
performance to large language models.
",2023-10-10T22:53:15Z,"Xueren Ge, Satpathy Abhishek, Ronald Dean Williams, John A. Stankovic, Homa Alemzadeh",http://arxiv.org/pdf/2310.07059v2
Multi-step Inference over Unstructured Data,"  The advent of Large Language Models (LLMs) and Generative AI has
revolutionized natural language applications across various domains. However,
high-stakes decision-making tasks in fields such as medical, legal and finance
require a level of precision, comprehensiveness, and logical consistency that
pure LLM or Retrieval-Augmented-Generation (RAG) approaches often fail to
deliver. At Elemental Cognition (EC), we have developed a neuro-symbolic AI
platform to tackle these problems. The platform integrates fine-tuned LLMs for
knowledge extraction and alignment with a robust symbolic reasoning engine for
logical inference, planning and interactive constraint solving. We describe
Cora, a Collaborative Research Assistant built on this platform, that is
designed to perform complex research and discovery tasks in high-stakes
domains. This paper discusses the multi-step inference challenges inherent in
such domains, critiques the limitations of existing LLM-based methods, and
demonstrates how Cora's neuro-symbolic approach effectively addresses these
issues. We provide an overview of the system architecture, key algorithms for
knowledge extraction and formal reasoning, and present preliminary evaluation
results that highlight Cora's superior performance compared to well-known LLM
and RAG baselines.
",2024-06-26T00:00:45Z,"Aditya Kalyanpur, Kailash Karthik Saravanakumar, Victor Barres, CJ McFate, Lori Moon, Nati Seifu, Maksim Eremeev, Jose Barrera, Abraham Bautista-Castillo, Eric Brown, David Ferrucci",http://arxiv.org/pdf/2406.17987v4
"Novel Development of LLM Driven mCODE Data Model for Improved Clinical
  Trial Matching to Enable Standardization and Interoperability in Oncology
  Research","  Each year, the lack of efficient data standardization and interoperability in
cancer care contributes to the severe lack of timely and effective diagnosis,
while constantly adding to the burden of cost, with cancer costs nationally
reaching over $208 billion in 2023 alone. Traditional methods regarding
clinical trial enrollment and clinical care in oncology are often manual,
time-consuming, and lack a data-driven approach. This paper presents a novel
framework to streamline standardization, interoperability, and exchange of
cancer domains and enhance the integration of oncology-based EHRs across
disparate healthcare systems. This paper utilizes advanced LLMs and Computer
Engineering to streamline cancer clinical trials and discovery. By utilizing
FHIR's resource-based approach and LLM-generated mCODE profiles, we ensure
timely, accurate, and efficient sharing of patient information across disparate
healthcare systems. Our methodology involves transforming unstructured patient
treatment data, PDFs, free-text information, and progress notes into enriched
mCODE profiles, facilitating seamless integration with our novel AI and
ML-based clinical trial matching engine. The results of this study show a
significant improvement in data standardization, with accuracy rates of our
trained LLM peaking at over 92% with datasets consisting of thousands of
patient data. Additionally, our LLM demonstrated an accuracy rate of 87% for
SNOMED-CT, 90% for LOINC, and 84% for RxNorm codes. This trumps the current
status quo, with LLMs such as GPT-4 and Claude's 3.5 peaking at an average of
77%. This paper successfully underscores the potential of our standardization
and interoperability framework, paving the way for more efficient and
personalized cancer treatment.
",2024-10-18T17:31:35Z,"Aarsh Shekhar, Mincheol Kim",http://arxiv.org/pdf/2410.19826v1
"MedBioLM: Optimizing Medical and Biological QA with Fine-Tuned Large
  Language Models and Retrieval-Augmented Generation","  Large Language Models (LLMs) have demonstrated impressive capabilities across
natural language processing tasks. However, their application to specialized
domains such as medicine and biology requires further optimization to ensure
factual accuracy, reliability, and contextual depth. We introduce MedBioLM, a
domain-adapted biomedical question-answering model designed to enhance both
short-form and long-form queries. By integrating fine-tuning and
retrieval-augmented generation (RAG), MedBioLM dynamically incorporates
domain-specific knowledge, improving reasoning abilities and factual accuracy.
To evaluate its effectiveness, we fine-tuned the model on diverse biomedical QA
datasets, covering structured multiple-choice assessments and complex clinical
reasoning tasks. Fine-tuning significantly improves accuracy on benchmark
datasets, while RAG enhances factual consistency. These results highlight the
potential of domain-optimized LLMs in advancing biomedical research, medical
education, and clinical decision support.
",2025-02-05T08:58:35Z,Seonok Kim,http://arxiv.org/pdf/2502.03004v1
Text2MDT: Extracting Medical Decision Trees from Medical Texts,"  Knowledge of the medical decision process, which can be modeled as medical
decision trees (MDTs), is critical to build clinical decision support systems.
However, the current MDT construction methods rely heavily on time-consuming
and laborious manual annotation. In this work, we propose a novel task,
Text2MDT, to explore the automatic extraction of MDTs from medical texts such
as medical guidelines and textbooks. We normalize the form of the MDT and
create an annotated Text-to-MDT dataset in Chinese with the participation of
medical experts. We investigate two different methods for the Text2MDT tasks:
(a) an end-to-end framework which only relies on a GPT style large language
models (LLM) instruction tuning to generate all the node information and tree
structures. (b) The pipeline framework which decomposes the Text2MDT task to
three subtasks. Experiments on our Text2MDT dataset demonstrate that: (a) the
end-to-end method basd on LLMs (7B parameters or larger) show promising
results, and successfully outperform the pipeline methods. (b) The
chain-of-thought (COT) prompting method \cite{Wei2022ChainOT} can improve the
performance of the fine-tuned LLMs on the Text2MDT test set. (c) the
lightweight pipelined method based on encoder-based pretrained models can
perform comparably with LLMs with model complexity two magnititudes smaller.
Our Text2MDT dataset is open-sourced at
\url{https://tianchi.aliyun.com/dataset/95414}, and the source codes are
open-sourced at \url{https://github.com/michael-wzhu/text2dt}.
",2024-01-04T02:33:38Z,"Wei Zhu, Wenfeng Li, Xing Tian, Pengfei Wang, Xiaoling Wang, Jin Chen, Yuanbin Wu, Yuan Ni, Guotong Xie",http://arxiv.org/pdf/2401.02034v1
"Cancer Vaccine Adjuvant Name Recognition from Biomedical Literature
  using Large Language Models","  Motivation: An adjuvant is a chemical incorporated into vaccines that
enhances their efficacy by improving the immune response. Identifying adjuvant
names from cancer vaccine studies is essential for furthering research and
enhancing immunotherapies. However, the manual curation from the constantly
expanding biomedical literature poses significant challenges. This study
explores the automated recognition of vaccine adjuvant names using Large
Language Models (LLMs), specifically Generative Pretrained Transformers (GPT)
and Large Language Model Meta AI (Llama). Methods: We utilized two datasets: 97
clinical trial records from AdjuvareDB and 290 abstracts annotated with the
Vaccine Adjuvant Compendium (VAC). GPT-4o and Llama 3.2 were employed in
zero-shot and few-shot learning paradigms with up to four examples per prompt.
Prompts explicitly targeted adjuvant names, testing the impact of contextual
information such as substances or interventions. Outputs underwent automated
and manual validation for accuracy and consistency. Results: GPT-4o attained
100% Precision across all situations while exhibiting notable improve in Recall
and F1-scores, particularly with incorporating interventions. On the VAC
dataset, GPT-4o achieved a maximum F1-score of 77.32% with interventions,
surpassing Llama-3.2-3B by approximately 2%. On the AdjuvareDB dataset, GPT-4o
reached an F1-score of 81.67% for three-shot prompting with interventions,
surpassing Llama-3.2-3 B's maximum F1-score of 65.62%. Conclusion: Our findings
demonstrate that LLMs excel at identifying adjuvant names, including rare
variations of naming representation. This study emphasizes the capability of
LLMs to enhance cancer vaccine development by efficiently extracting insights.
Future work aims to broaden the framework to encompass various biomedical
literature and enhance model generalizability across various vaccines and
adjuvants.
",2025-02-12T06:30:31Z,"Hasin Rehana, Jie Zheng, Leo Yeh, Benu Bansal, Nur Bengisu Çam, Christianah Jemiyo, Brett McGregor, Arzucan Özgür, Yongqun He, Junguk Hur",http://arxiv.org/pdf/2502.09659v1
