Title,Summary,Published Date,Authors,PDF Link
"REALM: RAG-Driven Enhancement of Multimodal Electronic Health Records
  Analysis via Large Language Models","  The integration of multimodal Electronic Health Records (EHR) data has
significantly improved clinical predictive capabilities. Leveraging clinical
notes and multivariate time-series EHR, existing models often lack the medical
context relevent to clinical tasks, prompting the incorporation of external
knowledge, particularly from the knowledge graph (KG). Previous approaches with
KG knowledge have primarily focused on structured knowledge extraction,
neglecting unstructured data modalities and semantic high dimensional medical
knowledge. In response, we propose REALM, a Retrieval-Augmented Generation
(RAG) driven framework to enhance multimodal EHR representations that address
these limitations. Firstly, we apply Large Language Model (LLM) to encode long
context clinical notes and GRU model to encode time-series EHR data. Secondly,
we prompt LLM to extract task-relevant medical entities and match entities in
professionally labeled external knowledge graph (PrimeKG) with corresponding
medical knowledge. By matching and aligning with clinical standards, our
framework eliminates hallucinations and ensures consistency. Lastly, we propose
an adaptive multimodal fusion network to integrate extracted knowledge with
multimodal EHR data. Our extensive experiments on MIMIC-III mortality and
readmission tasks showcase the superior performance of our REALM framework over
baselines, emphasizing the effectiveness of each module. REALM framework
contributes to refining the use of multimodal EHR data in healthcare and
bridging the gap with nuanced medical context essential for informed clinical
predictions.
",2024-02-10T18:27:28Z,"Yinghao Zhu, Changyu Ren, Shiyun Xie, Shukai Liu, Hangyuan Ji, Zixiang Wang, Tao Sun, Long He, Zhoujun Li, Xi Zhu, Chengwei Pan",http://arxiv.org/pdf/2402.07016v1
"EMERGE: Enhancing Multimodal Electronic Health Records Predictive
  Modeling with Retrieval-Augmented Generation","  The integration of multimodal Electronic Health Records (EHR) data has
significantly advanced clinical predictive capabilities. Existing models, which
utilize clinical notes and multivariate time-series EHR data, often fall short
of incorporating the necessary medical context for accurate clinical tasks,
while previous approaches with knowledge graphs (KGs) primarily focus on
structured knowledge extraction. In response, we propose EMERGE, a
Retrieval-Augmented Generation (RAG) driven framework to enhance multimodal EHR
predictive modeling. We extract entities from both time-series data and
clinical notes by prompting Large Language Models (LLMs) and align them with
professional PrimeKG, ensuring consistency. In addition to triplet
relationships, we incorporate entities' definitions and descriptions for richer
semantics. The extracted knowledge is then used to generate task-relevant
summaries of patients' health statuses. Finally, we fuse the summary with other
modalities using an adaptive multimodal fusion network with cross-attention.
Extensive experiments on the MIMIC-III and MIMIC-IV datasets' in-hospital
mortality and 30-day readmission tasks demonstrate the superior performance of
the EMERGE framework over baseline models. Comprehensive ablation studies and
analysis highlight the efficacy of each designed module and robustness to data
sparsity. EMERGE contributes to refining the utilization of multimodal EHR data
in healthcare, bridging the gap with nuanced medical contexts essential for
informed clinical predictions. We have publicly released the code at
https://github.com/yhzhu99/EMERGE.
",2024-05-27T10:53:15Z,"Yinghao Zhu, Changyu Ren, Zixiang Wang, Xiaochen Zheng, Shiyun Xie, Junlan Feng, Xi Zhu, Zhoujun Li, Liantao Ma, Chengwei Pan",http://arxiv.org/pdf/2406.00036v2
"Is larger always better? Evaluating and prompting large language models
  for non-generative medical tasks","  The use of Large Language Models (LLMs) in medicine is growing, but their
ability to handle both structured Electronic Health Record (EHR) data and
unstructured clinical notes is not well-studied. This study benchmarks various
models, including GPT-based LLMs, BERT-based models, and traditional clinical
predictive models, for non-generative medical tasks utilizing renowned
datasets. We assessed 14 language models (9 GPT-based and 5 BERT-based) and 7
traditional predictive models using the MIMIC dataset (ICU patient records) and
the TJH dataset (early COVID-19 EHR data), focusing on tasks such as mortality
and readmission prediction, disease hierarchy reconstruction, and biomedical
sentence matching, comparing both zero-shot and finetuned performance. Results
indicated that LLMs exhibited robust zero-shot predictive capabilities on
structured EHR data when using well-designed prompting strategies, frequently
surpassing traditional models. However, for unstructured medical texts, LLMs
did not outperform finetuned BERT models, which excelled in both supervised and
unsupervised tasks. Consequently, while LLMs are effective for zero-shot
learning on structured data, finetuned BERT models are more suitable for
unstructured texts, underscoring the importance of selecting models based on
specific task requirements and data characteristics to optimize the application
of NLP technology in healthcare.
",2024-07-26T06:09:10Z,"Yinghao Zhu, Junyi Gao, Zixiang Wang, Weibin Liao, Xiaochen Zheng, Lifang Liang, Yasha Wang, Chengwei Pan, Ewen M. Harrison, Liantao Ma",http://arxiv.org/pdf/2407.18525v1
"EHRmonize: A Framework for Medical Concept Abstraction from Electronic
  Health Records using Large Language Models","  Electronic health records (EHRs) contain vast amounts of complex data, but
harmonizing and processing this information remains a challenging and costly
task requiring significant clinical expertise. While large language models
(LLMs) have shown promise in various healthcare applications, their potential
for abstracting medical concepts from EHRs remains largely unexplored. We
introduce EHRmonize, a framework leveraging LLMs to abstract medical concepts
from EHR data. Our study uses medication data from two real-world EHR databases
to evaluate five LLMs on two free-text extraction and six binary classification
tasks across various prompting strategies. GPT-4o's with 10-shot prompting
achieved the highest performance in all tasks, accompanied by Claude-3.5-Sonnet
in a subset of tasks. GPT-4o achieved an accuracy of 97% in identifying generic
route names, 82% for generic drug names, and 100% in performing binary
classification of antibiotics. While EHRmonize significantly enhances
efficiency, reducing annotation time by an estimated 60%, we emphasize that
clinician oversight remains essential. Our framework, available as a Python
package, offers a promising tool to assist clinicians in EHR data abstraction,
potentially accelerating healthcare research and improving data harmonization
processes.
",2024-06-28T21:39:20Z,"João Matos, Jack Gallifant, Jian Pei, A. Ian Wong",http://arxiv.org/pdf/2407.00242v1
"ColaCare: Enhancing Electronic Health Record Modeling through Large
  Language Model-Driven Multi-Agent Collaboration","  We introduce ColaCare, a framework that enhances Electronic Health Record
(EHR) modeling through multi-agent collaboration driven by Large Language
Models (LLMs). Our approach seamlessly integrates domain-specific expert models
with LLMs to bridge the gap between structured EHR data and text-based
reasoning. Inspired by the Multidisciplinary Team (MDT) approach used in
clinical settings, ColaCare employs two types of agents: DoctorAgents and a
MetaAgent, which collaboratively analyze patient data. Expert models process
and generate predictions from numerical EHR data, while LLM agents produce
reasoning references and decision-making reports within the MDT-driven
collaborative consultation framework. The MetaAgent orchestrates the
discussion, facilitating consultations and evidence-based debates among
DoctorAgents, simulating diverse expertise in clinical decision-making. We
additionally incorporate the Merck Manual of Diagnosis and Therapy (MSD)
medical guideline within a retrieval-augmented generation (RAG) module for
medical evidence support, addressing the challenge of knowledge currency.
Extensive experiments conducted on three EHR datasets demonstrate ColaCare's
superior performance in clinical mortality outcome and readmission prediction
tasks, underscoring its potential to revolutionize clinical decision support
systems and advance personalized precision medicine. All code, case studies and
a questionnaire are available at the project website:
https://colacare.netlify.app.
",2024-10-03T14:55:22Z,"Zixiang Wang, Yinghao Zhu, Huiya Zhao, Xiaochen Zheng, Dehao Sui, Tianlong Wang, Wen Tang, Yasha Wang, Ewen Harrison, Chengwei Pan, Junyi Gao, Liantao Ma",http://arxiv.org/pdf/2410.02551v2
"Retrospective Comparative Analysis of Prostate Cancer In-Basket
  Messages: Responses from Closed-Domain LLM vs. Clinical Teams","  In-basket message interactions play a crucial role in physician-patient
communication, occurring during all phases (pre-, during, and post) of a
patient's care journey. However, responding to these patients' inquiries has
become a significant burden on healthcare workflows, consuming considerable
time for clinical care teams. To address this, we introduce RadOnc-GPT, a
specialized Large Language Model (LLM) powered by GPT-4 that has been designed
with a focus on radiotherapeutic treatment of prostate cancer with advanced
prompt engineering, and specifically designed to assist in generating
responses. We integrated RadOnc-GPT with patient electronic health records
(EHR) from both the hospital-wide EHR database and an internal,
radiation-oncology-specific database. RadOnc-GPT was evaluated on 158
previously recorded in-basket message interactions. Quantitative natural
language processing (NLP) analysis and two grading studies with clinicians and
nurses were used to assess RadOnc-GPT's responses. Our findings indicate that
RadOnc-GPT slightly outperformed the clinical care team in ""Clarity"" and
""Empathy,"" while achieving comparable scores in ""Completeness"" and
""Correctness."" RadOnc-GPT is estimated to save 5.2 minutes per message for
nurses and 2.4 minutes for clinicians, from reading the inquiry to sending the
response. Employing RadOnc-GPT for in-basket message draft generation has the
potential to alleviate the workload of clinical care teams and reduce
healthcare costs by producing high-quality, timely responses.
",2024-09-26T21:00:51Z,"Yuexing Hao, Jason M. Holmes, Jared Hobson, Alexandra Bennett, Daniel K. Ebner, David M. Routman, Satomi Shiraishi, Samir H. Patel, Nathan Y. Yu, Chris L. Hallemeier, Brooke E. Ball, Mark R. Waddle, Wei Liu",http://arxiv.org/pdf/2409.18290v1
A GEN AI Framework for Medical Note Generation,"  The increasing administrative burden of medical documentation, particularly
through Electronic Health Records (EHR), significantly reduces the time
available for direct patient care and contributes to physician burnout. To
address this issue, we propose MediNotes, an advanced generative AI framework
designed to automate the creation of SOAP (Subjective, Objective, Assessment,
Plan) notes from medical conversations. MediNotes integrates Large Language
Models (LLMs), Retrieval-Augmented Generation (RAG), and Automatic Speech
Recognition (ASR) to capture and process both text and voice inputs in real
time or from recorded audio, generating structured and contextually accurate
medical notes. The framework also incorporates advanced techniques like
Quantized Low-Rank Adaptation (QLoRA) and Parameter-Efficient Fine-Tuning
(PEFT) for efficient model fine-tuning in resource-constrained environments.
Additionally, MediNotes offers a query-based retrieval system, allowing
healthcare providers and patients to access relevant medical information
quickly and accurately. Evaluations using the ACI-BENCH dataset demonstrate
that MediNotes significantly improves the accuracy, efficiency, and usability
of automated medical documentation, offering a robust solution to reduce the
administrative burden on healthcare professionals while improving the quality
of clinical workflows.
",2024-09-27T23:05:02Z,"Hui Yi Leong, Yi Fan Gao, Shuai Ji, Bora Kalaycioglu, Uktu Pamuksuz",http://arxiv.org/pdf/2410.01841v1
"RGAR: Recurrence Generation-augmented Retrieval for Factual-aware
  Medical Question Answering","  Medical question answering requires extensive access to specialized
conceptual knowledge. The current paradigm, Retrieval-Augmented Generation
(RAG), acquires expertise medical knowledge through large-scale corpus
retrieval and uses this knowledge to guide a general-purpose large language
model (LLM) for generating answers. However, existing retrieval approaches
often overlook the importance of factual knowledge, which limits the relevance
of retrieved conceptual knowledge and restricts its applicability in real-world
scenarios, such as clinical decision-making based on Electronic Health Records
(EHRs). This paper introduces RGAR, a recurrence generation-augmented retrieval
framework that retrieves both relevant factual and conceptual knowledge from
dual sources (i.e., EHRs and the corpus), allowing them to interact and refine
each another. Through extensive evaluation across three factual-aware medical
question answering benchmarks, RGAR establishes a new state-of-the-art
performance among medical RAG systems. Notably, the Llama-3.1-8B-Instruct model
with RGAR surpasses the considerably larger, RAG-enhanced GPT-3.5. Our findings
demonstrate the benefit of extracting factual knowledge for retrieval, which
consistently yields improved generation quality.
",2025-02-19T01:50:10Z,"Sichu Liang, Linhai Zhang, Hongyu Zhu, Wenwen Wang, Yulan He, Deyu Zhou",http://arxiv.org/pdf/2502.13361v1
Classifying Cancer Stage with Open-Source Clinical Large Language Models,"  Cancer stage classification is important for making treatment and care
management plans for oncology patients. Information on staging is often
included in unstructured form in clinical, pathology, radiology and other
free-text reports in the electronic health record system, requiring extensive
work to parse and obtain. To facilitate the extraction of this information,
previous NLP approaches rely on labeled training datasets, which are
labor-intensive to prepare. In this study, we demonstrate that without any
labeled training data, open-source clinical large language models (LLMs) can
extract pathologic tumor-node-metastasis (pTNM) staging information from
real-world pathology reports. Our experiments compare LLMs and a BERT-based
model fine-tuned using the labeled data. Our findings suggest that while LLMs
still exhibit subpar performance in Tumor (T) classification, with the
appropriate adoption of prompting strategies, they can achieve comparable
performance on Metastasis (M) classification and improved performance on Node
(N) classification.
",2024-04-02T02:30:47Z,"Chia-Hsuan Chang, Mary M. Lucas, Grace Lu-Yao, Christopher C. Yang",http://arxiv.org/pdf/2404.01589v1
"Lessons Learned on Information Retrieval in Electronic Health Records: A
  Comparison of Embedding Models and Pooling Strategies","  Objective: Applying large language models (LLMs) to the clinical domain is
challenging due to the context-heavy nature of processing medical records.
Retrieval-augmented generation (RAG) offers a solution by facilitating
reasoning over large text sources. However, there are many parameters to
optimize in just the retrieval system alone. This paper presents an ablation
study exploring how different embedding models and pooling methods affect
information retrieval for the clinical domain.
  Methods: Evaluating on three retrieval tasks on two electronic health record
(EHR) data sources, we compared seven models, including medical- and
general-domain models, specialized encoder embedding models, and off-the-shelf
decoder LLMs. We also examine the choice of embedding pooling strategy for each
model, independently on the query and the text to retrieve.
  Results: We found that the choice of embedding model significantly impacts
retrieval performance, with BGE, a comparatively small general-domain model,
consistently outperforming all others, including medical-specific models.
However, our findings also revealed substantial variability across datasets and
query text phrasings. We also determined the best pooling methods for each of
these models to guide future design of retrieval systems.
  Discussion: The choice of embedding model, pooling strategy, and query
formulation can significantly impact retrieval performance and the performance
of these models on other public benchmarks does not necessarily transfer to new
domains. Further studies such as this one are vital for guiding
empirically-grounded development of retrieval frameworks, such as in the
context of RAG, for the clinical domain.
",2024-09-23T16:16:08Z,"Skatje Myers, Timothy A. Miller, Yanjun Gao, Matthew M. Churpek, Anoop Mayampurath, Dmitriy Dligach, Majid Afshar",http://arxiv.org/pdf/2409.15163v1
"CancerKG.ORG A Web-scale, Interactive, Verifiable Knowledge Graph-LLM
  Hybrid for Assisting with Optimal Cancer Treatment and Care","  Here, we describe one of the first Web-scale hybrid Knowledge Graph
(KG)-Large Language Model (LLM), populated with the latest peer-reviewed
medical knowledge on colorectal Cancer. It is currently being evaluated to
assist with both medical research and clinical information retrieval tasks at
Moffitt Cancer Center, which is one of the top Cancer centers in the U.S. and
in the world. Our hybrid is remarkable as it serves the user needs better than
just an LLM, KG or a search-engine in isolation. LLMs as is are known to
exhibit hallucinations and catastrophic forgetting as well as are trained on
outdated corpora. The state of the art KGs, such as PrimeKG, cBioPortal,
ChEMBL, NCBI, and other require manual curation, hence are quickly getting
stale. CancerKG is unsupervised and is capable of automatically ingesting and
organizing the latest medical findings. To alleviate the LLMs shortcomings, the
verified KG serves as a Retrieval Augmented Generation (RAG) guardrail.
CancerKG exhibits 5 different advanced user interfaces, each tailored to serve
different data modalities better and more convenient for the user.
",2024-12-31T02:19:16Z,"Michael Gubanov, Anna Pyayt, Aleksandra Karolak",http://arxiv.org/pdf/2501.00223v1
"AIPatient: Simulating Patients with EHRs and LLM Powered Agentic
  Workflow","  Simulated patient systems play a crucial role in modern medical education and
research, providing safe, integrative learning environments and enabling
clinical decision-making simulations. Large Language Models (LLM) could advance
simulated patient systems by replicating medical conditions and patient-doctor
interactions with high fidelity and low cost. However, ensuring the
effectiveness and trustworthiness of these systems remains a challenge, as they
require a large, diverse, and precise patient knowledgebase, along with a
robust and stable knowledge diffusion to users. Here, we developed AIPatient,
an advanced simulated patient system with AIPatient Knowledge Graph (AIPatient
KG) as the input and the Reasoning Retrieval-Augmented Generation (Reasoning
RAG) agentic workflow as the generation backbone. AIPatient KG samples data
from Electronic Health Records (EHRs) in the Medical Information Mart for
Intensive Care (MIMIC)-III database, producing a clinically diverse and
relevant cohort of 1,495 patients with high knowledgebase validity (F1 0.89).
Reasoning RAG leverages six LLM powered agents spanning tasks including
retrieval, KG query generation, abstraction, checker, rewrite, and
summarization. This agentic framework reaches an overall accuracy of 94.15% in
EHR-based medical Question Answering (QA), outperforming benchmarks that use
either no agent or only partial agent integration. Our system also presents
high readability (median Flesch Reading Ease 77.23; median Flesch Kincaid Grade
5.6), robustness (ANOVA F-value 0.6126, p>0.1), and stability (ANOVA F-value
0.782, p>0.1). The promising performance of the AIPatient system highlights its
potential to support a wide range of applications, including medical education,
model evaluation, and system integration.
",2024-09-27T17:17:15Z,"Huizi Yu, Jiayan Zhou, Lingyao Li, Shan Chen, Jack Gallifant, Anye Shi, Xiang Li, Wenyue Hua, Mingyu Jin, Guang Chen, Yang Zhou, Zhao Li, Trisha Gupte, Ming-Li Chen, Zahra Azizi, Yongfeng Zhang, Themistocles L. Assimes, Xin Ma, Danielle S. Bitterman, Lin Lu, Lizhou Fan",http://arxiv.org/pdf/2409.18924v2
"medIKAL: Integrating Knowledge Graphs as Assistants of LLMs for Enhanced
  Clinical Diagnosis on EMRs","  Electronic Medical Records (EMRs), while integral to modern healthcare,
present challenges for clinical reasoning and diagnosis due to their complexity
and information redundancy. To address this, we proposed medIKAL (Integrating
Knowledge Graphs as Assistants of LLMs), a framework that combines Large
Language Models (LLMs) with knowledge graphs (KGs) to enhance diagnostic
capabilities. medIKAL assigns weighted importance to entities in medical
records based on their type, enabling precise localization of candidate
diseases within KGs. It innovatively employs a residual network-like approach,
allowing initial diagnosis by the LLM to be merged into KG search results.
Through a path-based reranking algorithm and a fill-in-the-blank style prompt
template, it further refined the diagnostic process. We validated medIKAL's
effectiveness through extensive experiments on a newly introduced open-sourced
Chinese EMR dataset, demonstrating its potential to improve clinical diagnosis
in real-world settings.
",2024-06-20T13:56:52Z,"Mingyi Jia, Junwen Duan, Yan Song, Jianxin Wang",http://arxiv.org/pdf/2406.14326v3
"MedRAG: Enhancing Retrieval-augmented Generation with Knowledge
  Graph-Elicited Reasoning for Healthcare Copilot","  Retrieval-augmented generation (RAG) is a well-suited technique for
retrieving privacy-sensitive Electronic Health Records (EHR). It can serve as a
key module of the healthcare copilot, helping reduce misdiagnosis for
healthcare practitioners and patients. However, the diagnostic accuracy and
specificity of existing heuristic-based RAG models used in the medical domain
are inadequate, particularly for diseases with similar manifestations. This
paper proposes MedRAG, a RAG model enhanced by knowledge graph (KG)-elicited
reasoning for the medical domain that retrieves diagnosis and treatment
recommendations based on manifestations. MedRAG systematically constructs a
comprehensive four-tier hierarchical diagnostic KG encompassing critical
diagnostic differences of various diseases. These differences are dynamically
integrated with similar EHRs retrieved from an EHR database, and reasoned
within a large language model. This process enables more accurate and specific
decision support, while also proactively providing follow-up questions to
enhance personalized medical decision-making. MedRAG is evaluated on both a
public dataset DDXPlus and a private chronic pain diagnostic dataset (CPDD)
collected from Tan Tock Seng Hospital, and its performance is compared against
various existing RAG methods. Experimental results show that, leveraging the
information integration and relational abilities of the KG, our MedRAG provides
more specific diagnostic insights and outperforms state-of-the-art models in
reducing misdiagnosis rates. Our code will be available at
https://github.com/SNOWTEAM2023/MedRAG
",2025-02-06T12:27:35Z,"Xuejiao Zhao, Siyan Liu, Su-Yin Yang, Chunyan Miao",http://arxiv.org/pdf/2502.04413v1
"DualMAR: Medical-Augmented Representation from Dual-Expertise
  Perspectives","  Electronic Health Records (EHR) has revolutionized healthcare data management
and prediction in the field of AI and machine learning. Accurate predictions of
diagnosis and medications significantly mitigate health risks and provide
guidance for preventive care. However, EHR driven models often have limited
scope on understanding medical-domain knowledge and mostly rely on
simple-and-sole ontologies. In addition, due to the missing features and
incomplete disease coverage of EHR, most studies only focus on basic analysis
on conditions and medication. We propose DualMAR, a framework that enhances EHR
prediction tasks through both individual observation data and public knowledge
bases. First, we construct a bi-hierarchical Diagnosis Knowledge Graph (KG)
using verified public clinical ontologies and augment this KG via Large
Language Models (LLMs); Second, we design a new proxy-task learning on lab
results in EHR for pretraining, which further enhance KG representation and
patient embeddings. By retrieving radial and angular coordinates upon polar
space, DualMAR enables accurate predictions based on rich hierarchical and
semantic embeddings from KG. Experiments also demonstrate that DualMAR
outperforms state-of-the-art models, validating its effectiveness in EHR
prediction and KG integration in medical domains.
",2024-10-25T20:25:22Z,"Pengfei Hu, Chang Lu, Fei Wang, Yue Ning",http://arxiv.org/pdf/2410.19955v1
