Title,Summary,Published Date,Authors,PDF Link
"The Potential and Pitfalls of using a Large Language Model such as
  ChatGPT or GPT-4 as a Clinical Assistant","  Recent studies have demonstrated promising performance of ChatGPT and GPT-4
on several medical domain tasks. However, none have assessed its performance
using a large-scale real-world electronic health record database, nor have
evaluated its utility in providing clinical diagnostic assistance for patients
across a full range of disease presentation. We performed two analyses using
ChatGPT and GPT-4, one to identify patients with specific medical diagnoses
using a real-world large electronic health record database and the other, in
providing diagnostic assistance to healthcare workers in the prospective
evaluation of hypothetical patients. Our results show that GPT-4 across disease
classification tasks with chain of thought and few-shot prompting can achieve
performance as high as 96% F1 scores. For patient assessment, GPT-4 can
accurately diagnose three out of four times. However, there were mentions of
factually incorrect statements, overlooking crucial medical findings,
recommendations for unnecessary investigations and overtreatment. These issues
coupled with privacy concerns, make these models currently inadequate for real
world clinical use. However, limited data and time needed for prompt
engineering in comparison to configuration of conventional machine learning
workflows highlight their potential for scalability across healthcare
applications.
",2023-07-16T21:19:47Z,"Jingqing Zhang, Kai Sun, Akshay Jagadeesh, Mahta Ghahfarokhi, Deepa Gupta, Ashok Gupta, Vibhor Gupta, Yike Guo",http://arxiv.org/pdf/2307.08152v1
MedPromptX: Grounded Multimodal Prompting for Chest X-ray Diagnosis,"  Chest X-ray images are commonly used for predicting acute and chronic
cardiopulmonary conditions, but efforts to integrate them with structured
clinical data face challenges due to incomplete electronic health records
(EHR). This paper introduces MedPromptX, the first clinical decision support
system that integrates multimodal large language models (MLLMs), few-shot
prompting (FP) and visual grounding (VG) to combine imagery with EHR data for
chest X-ray diagnosis. A pre-trained MLLM is utilized to complement the missing
EHR information, providing a comprehensive understanding of patients' medical
history. Additionally, FP reduces the necessity for extensive training of MLLMs
while effectively tackling the issue of hallucination. Nevertheless, the
process of determining the optimal number of few-shot examples and selecting
high-quality candidates can be burdensome, yet it profoundly influences model
performance. Hence, we propose a new technique that dynamically refines
few-shot data for real-time adjustment to new patient scenarios. Moreover, VG
narrows the search area in X-ray images, thereby enhancing the identification
of abnormalities. We also release MedPromptX-VQA, a new in-context visual
question answering dataset encompassing interleaved images and EHR data derived
from MIMIC-IV and MIMIC-CXR-JPG databases. Results demonstrate the SOTA
performance of MedPromptX, achieving an 11% improvement in F1-score compared to
the baselines. Code and data are publicly available on
https://github.com/BioMedIA-MBZUAI/MedPromptX.
",2024-03-22T19:19:51Z,"Mai A. Shaaban, Adnan Khan, Mohammad Yaqub",http://arxiv.org/pdf/2403.15585v4
"Clinical Decision Transformer: Intended Treatment Recommendation through
  Goal Prompting","  With recent achievements in tasks requiring context awareness, foundation
models have been adopted to treat large-scale data from electronic health
record (EHR) systems. However, previous clinical recommender systems based on
foundation models have a limited purpose of imitating clinicians' behavior and
do not directly consider a problem of missing values. In this paper, we propose
Clinical Decision Transformer (CDT), a recommender system that generates a
sequence of medications to reach a desired range of clinical states given as
goal prompts. For this, we conducted goal-conditioned sequencing, which
generated a subsequence of treatment history with prepended future goal state,
and trained the CDT to model sequential medications required to reach that goal
state. For contextual embedding over intra-admission and inter-admissions, we
adopted a GPT-based architecture with an admission-wise attention mask and
column embedding. In an experiment, we extracted a diabetes dataset from an EHR
system, which contained treatment histories of 4788 patients. We observed that
the CDT achieved the intended treatment effect according to goal prompt ranges
(e.g., NormalA1c, LowerA1c, and HigherA1c), contrary to the case with behavior
cloning. To the best of our knowledge, this is the first study to explore
clinical recommendations from the perspective of goal prompting. See
https://clinical-decision-transformer.github.io for code and additional
information.
",2023-02-01T17:26:01Z,"Seunghyun Lee, Da Young Lee, Sujeong Im, Nan Hee Kim, Sung-Min Park",http://arxiv.org/pdf/2302.00612v1
"Evaluation of General Large Language Models in Contextually Assessing
  Semantic Concepts Extracted from Adult Critical Care Electronic Health Record
  Notes","  The field of healthcare has increasingly turned its focus towards Large
Language Models (LLMs) due to their remarkable performance. However, their
performance in actual clinical applications has been underexplored. Traditional
evaluations based on question-answering tasks don't fully capture the nuanced
contexts. This gap highlights the need for more in-depth and practical
assessments of LLMs in real-world healthcare settings. Objective: We sought to
evaluate the performance of LLMs in the complex clinical context of adult
critical care medicine using systematic and comprehensible analytic methods,
including clinician annotation and adjudication. Methods: We investigated the
performance of three general LLMs in understanding and processing real-world
clinical notes. Concepts from 150 clinical notes were identified by MetaMap and
then labeled by 9 clinicians. Each LLM's proficiency was evaluated by
identifying the temporality and negation of these concepts using different
prompts for an in-depth analysis. Results: GPT-4 showed overall superior
performance compared to other LLMs. In contrast, both GPT-3.5 and
text-davinci-003 exhibit enhanced performance when the appropriate prompting
strategies are employed. The GPT family models have demonstrated considerable
efficiency, evidenced by their cost-effectiveness and time-saving capabilities.
Conclusion: A comprehensive qualitative performance evaluation framework for
LLMs is developed and operationalized. This framework goes beyond singular
performance aspects. With expert annotations, this methodology not only
validates LLMs' capabilities in processing complex medical data but also
establishes a benchmark for future LLM evaluations across specialized domains.
",2024-01-24T16:52:37Z,"Darren Liu, Cheng Ding, Delgersuren Bold, Monique Bouvier, Jiaying Lu, Benjamin Shickel, Craig S. Jabaley, Wenhui Zhang, Soojin Park, Michael J. Young, Mark S. Wainwright, Gilles Clermont, Parisa Rashidi, Eric S. Rosenthal, Laurie Dimisko, Ran Xiao, Joo Heung Yoon, Carl Yang, Xiao Hu",http://arxiv.org/pdf/2401.13588v1
"Language Models and Retrieval Augmented Generation for Automated
  Structured Data Extraction from Diagnostic Reports","  Purpose: To develop and evaluate an automated system for extracting
structured clinical information from unstructured radiology and pathology
reports using open-weights large language models (LMs) and retrieval augmented
generation (RAG), and to assess the effects of model configuration variables on
extraction performance. Methods and Materials: The study utilized two datasets:
7,294 radiology reports annotated for Brain Tumor Reporting and Data System
(BT-RADS) scores and 2,154 pathology reports annotated for isocitrate
dehydrogenase (IDH) mutation status. An automated pipeline was developed to
benchmark the performance of various LMs and RAG configurations. The impact of
model size, quantization, prompting strategies, output formatting, and
inference parameters was systematically evaluated. Results: The best performing
models achieved over 98% accuracy in extracting BT-RADS scores from radiology
reports and over 90% for IDH mutation status extraction from pathology reports.
The top model being medical fine-tuned llama3. Larger, newer, and domain
fine-tuned models consistently outperformed older and smaller models. Model
quantization had minimal impact on performance. Few-shot prompting
significantly improved accuracy. RAG improved performance for complex pathology
reports but not for shorter radiology reports. Conclusions: Open LMs
demonstrate significant potential for automated extraction of structured
clinical data from unstructured clinical reports with local privacy-preserving
application. Careful model selection, prompt engineering, and semi-automated
optimization using annotated data are critical for optimal performance. These
approaches could be reliable enough for practical use in research workflows,
highlighting the potential for human-machine collaboration in healthcare data
extraction.
",2024-09-15T15:21:45Z,"Mohamed Sobhi Jabal, Pranav Warman, Jikai Zhang, Kartikeye Gupta, Ayush Jain, Maciej Mazurowski, Walter Wiggins, Kirti Magudia, Evan Calabrese",http://arxiv.org/pdf/2409.10576v2
"RAMIE: Retrieval-Augmented Multi-task Information Extraction with Large
  Language Models on Dietary Supplements","  \textbf{Objective:} We aimed to develop an advanced multi-task large language
model (LLM) framework to extract multiple types of information about dietary
supplements (DS) from clinical records.
  \textbf{Methods:} We used four core DS information extraction tasks - namely,
named entity recognition (NER: 2,949 clinical sentences), relation extraction
(RE: 4,892 sentences), triple extraction (TE: 2,949 sentences), and usage
classification (UC: 2,460 sentences) as our multitasks. We introduced a novel
Retrieval-Augmented Multi-task Information Extraction (RAMIE) Framework,
including: 1) employed instruction fine-tuning techniques with task-specific
prompts, 2) trained LLMs for multiple tasks with improved storage efficiency
and lower training costs, and 3) incorporated retrieval augmentation generation
(RAG) techniques by retrieving similar examples from the training set. We
compared RAMIE's performance to LLMs with instruction fine-tuning alone and
conducted an ablation study to assess the contributions of multi-task learning
and RAG to improved multitasking performance.
  \textbf{Results:} With the aid of the RAMIE framework, Llama2-13B achieved an
F1 score of 87.39 (3.51\% improvement) on the NER task and demonstrated
outstanding performance on the RE task with an F1 score of 93.74 (1.15\%
improvement). For the TE task, Llama2-7B scored 79.45 (14.26\% improvement),
and MedAlpaca-7B achieved the highest F1 score of 93.45 (0.94\% improvement) on
the UC task. The ablation study revealed that while MTL increased efficiency
with a slight trade-off in performance, RAG significantly boosted overall
accuracy.
  \textbf{Conclusion:} This study presents a novel RAMIE framework that
demonstrates substantial improvements in multi-task information extraction for
DS-related data from clinical records. Our framework can potentially be applied
to other domains.
",2024-11-24T03:56:43Z,"Zaifu Zhan, Shuang Zhou, Mingchen Li, Rui Zhang",http://arxiv.org/pdf/2411.15700v1
"An Empirical Evaluation of Prompting Strategies for Large Language
  Models in Zero-Shot Clinical Natural Language Processing","  Large language models (LLMs) have shown remarkable capabilities in Natural
Language Processing (NLP), especially in domains where labeled data is scarce
or expensive, such as clinical domain. However, to unlock the clinical
knowledge hidden in these LLMs, we need to design effective prompts that can
guide them to perform specific clinical NLP tasks without any task-specific
training data. This is known as in-context learning, which is an art and
science that requires understanding the strengths and weaknesses of different
LLMs and prompt engineering approaches. In this paper, we present a
comprehensive and systematic experimental study on prompt engineering for five
clinical NLP tasks: Clinical Sense Disambiguation, Biomedical Evidence
Extraction, Coreference Resolution, Medication Status Extraction, and
Medication Attribute Extraction. We assessed the prompts proposed in recent
literature, including simple prefix, simple cloze, chain of thought, and
anticipatory prompts, and introduced two new types of prompts, namely heuristic
prompting and ensemble prompting. We evaluated the performance of these prompts
on three state-of-the-art LLMs: GPT-3.5, BARD, and LLAMA2. We also contrasted
zero-shot prompting with few-shot prompting, and provide novel insights and
guidelines for prompt engineering for LLMs in clinical NLP. To the best of our
knowledge, this is one of the first works on the empirical evaluation of
different prompt engineering approaches for clinical NLP in this era of
generative AI, and we hope that it will inspire and inform future research in
this area.
",2023-09-14T19:35:00Z,"Sonish Sivarajkumar, Mark Kelley, Alyssa Samolyk-Mazzanti, Shyam Visweswaran, Yanshan Wang",http://arxiv.org/pdf/2309.08008v1
"Multi-OphthaLingua: A Multilingual Benchmark for Assessing and Debiasing
  LLM Ophthalmological QA in LMICs","  Current ophthalmology clinical workflows are plagued by over-referrals, long
waits, and complex and heterogeneous medical records. Large language models
(LLMs) present a promising solution to automate various procedures such as
triaging, preliminary tests like visual acuity assessment, and report
summaries. However, LLMs have demonstrated significantly varied performance
across different languages in natural language question-answering tasks,
potentially exacerbating healthcare disparities in Low and Middle-Income
Countries (LMICs). This study introduces the first multilingual
ophthalmological question-answering benchmark with manually curated questions
parallel across languages, allowing for direct cross-lingual comparisons. Our
evaluation of 6 popular LLMs across 7 different languages reveals substantial
bias across different languages, highlighting risks for clinical deployment of
LLMs in LMICs. Existing debiasing methods such as Translation Chain-of-Thought
or Retrieval-augmented generation (RAG) by themselves fall short of closing
this performance gap, often failing to improve performance across all languages
and lacking specificity for the medical domain. To address this issue, We
propose CLARA (Cross-Lingual Reflective Agentic system), a novel inference time
de-biasing method leveraging retrieval augmented generation and
self-verification. Our approach not only improves performance across all
languages but also significantly reduces the multilingual bias gap,
facilitating equitable LLM application across the globe.
",2024-12-18T20:18:03Z,"David Restrepo, Chenwei Wu, Zhengxu Tang, Zitao Shuai, Thao Nguyen Minh Phan, Jun-En Ding, Cong-Tinh Dao, Jack Gallifant, Robyn Gayle Dychiao, Jose Carlo Artiaga, André Hiroshi Bando, Carolina Pelegrini Barbosa Gracitelli, Vincenz Ferrer, Leo Anthony Celi, Danielle Bitterman, Michael G Morley, Luis Filipe Nakayama",http://arxiv.org/pdf/2412.14304v1
"Reasoning-Enhanced Healthcare Predictions with Knowledge Graph Community
  Retrieval","  Large language models (LLMs) have demonstrated significant potential in
clinical decision support. Yet LLMs still suffer from hallucinations and lack
fine-grained contextual medical knowledge, limiting their high-stake healthcare
applications such as clinical diagnosis. Traditional retrieval-augmented
generation (RAG) methods attempt to address these limitations but frequently
retrieve sparse or irrelevant information, undermining prediction accuracy. We
introduce KARE, a novel framework that integrates knowledge graph (KG)
community-level retrieval with LLM reasoning to enhance healthcare predictions.
KARE constructs a comprehensive multi-source KG by integrating biomedical
databases, clinical literature, and LLM-generated insights, and organizes it
using hierarchical graph community detection and summarization for precise and
contextually relevant information retrieval. Our key innovations include: (1) a
dense medical knowledge structuring approach enabling accurate retrieval of
relevant information; (2) a dynamic knowledge retrieval mechanism that enriches
patient contexts with focused, multi-faceted medical insights; and (3) a
reasoning-enhanced prediction framework that leverages these enriched contexts
to produce both accurate and interpretable clinical predictions. Extensive
experiments demonstrate that KARE outperforms leading models by up to
10.8-15.0% on MIMIC-III and 12.6-12.7% on MIMIC-IV for mortality and
readmission predictions. In addition to its impressive prediction accuracy, our
framework leverages the reasoning capabilities of LLMs, enhancing the
trustworthiness of clinical predictions.
",2024-10-06T18:46:28Z,"Pengcheng Jiang, Cao Xiao, Minhao Jiang, Parminder Bhatia, Taha Kass-Hout, Jimeng Sun, Jiawei Han",http://arxiv.org/pdf/2410.04585v1
"Iterative Prompt Refinement for Radiation Oncology Symptom Extraction
  Using Teacher-Student Large Language Models","  This study introduces a novel teacher-student architecture utilizing Large
Language Models (LLMs) to improve prostate cancer radiotherapy symptom
extraction from clinical notes. Mixtral, the student model, initially extracts
symptoms, followed by GPT-4, the teacher model, which refines prompts based on
Mixtral's performance. This iterative process involved 294 single symptom
clinical notes across 12 symptoms, with up to 16 rounds of refinement per
epoch. Results showed significant improvements in extracting symptoms from both
single and multi-symptom notes. For 59 single symptom notes, accuracy increased
from 0.51 to 0.71, precision from 0.52 to 0.82, recall from 0.52 to 0.72, and
F1 score from 0.49 to 0.73. In 375 multi-symptom notes, accuracy rose from 0.24
to 0.43, precision from 0.6 to 0.76, recall from 0.24 to 0.43, and F1 score
from 0.20 to 0.44. These results demonstrate the effectiveness of advanced
prompt engineering in LLMs for radiation oncology use.
",2024-02-06T15:25:09Z,"Reza Khanmohammadi, Ahmed I Ghanem, Kyle Verdecchia, Ryan Hall, Mohamed Elshaikh, Benjamin Movsas, Hassan Bagher-Ebadian, Indrin Chetty, Mohammad M. Ghassemi, Kundan Thind",http://arxiv.org/pdf/2402.04075v1
"Leveraging large language models for structured information extraction
  from pathology reports","  Background: Structured information extraction from unstructured
histopathology reports facilitates data accessibility for clinical research.
Manual extraction by experts is time-consuming and expensive, limiting
scalability. Large language models (LLMs) offer efficient automated extraction
through zero-shot prompting, requiring only natural language instructions
without labeled data or training. We evaluate LLMs' accuracy in extracting
structured information from breast cancer histopathology reports, compared to
manual extraction by a trained human annotator.
  Methods: We developed the Medical Report Information Extractor, a web
application leveraging LLMs for automated extraction. We developed a gold
standard extraction dataset to evaluate the human annotator alongside five LLMs
including GPT-4o, a leading proprietary model, and the Llama 3 model family,
which allows self-hosting for data privacy. Our assessment involved 111
histopathology reports from the Breast Cancer Now (BCN) Generations Study,
extracting 51 pathology features specified in the study's data dictionary.
  Results: Evaluation against the gold standard dataset showed that both Llama
3.1 405B (94.7% accuracy) and GPT-4o (96.1%) achieved extraction accuracy
comparable to the human annotator (95.4%; p = 0.146 and p = 0.106,
respectively). While Llama 3.1 70B (91.6%) performed below human accuracy (p
<0.001), its reduced computational requirements make it a viable option for
self-hosting.
  Conclusion: We developed an open-source tool for structured information
extraction that can be customized by non-programmers using natural language.
Its modular design enables reuse for various extraction tasks, producing
standardized, structured data from unstructured text reports to facilitate
analytics through improved accessibility and interoperability.
",2025-02-14T21:46:02Z,"Jeya Balaji Balasubramanian, Daniel Adams, Ioannis Roxanis, Amy Berrington de Gonzalez, Penny Coulson, Jonas S. Almeida, Montserrat García-Closas",http://arxiv.org/pdf/2502.12183v1
"Prompt engineering paradigms for medical applications: scoping review
  and recommendations for better practices","  Prompt engineering is crucial for harnessing the potential of large language
models (LLMs), especially in the medical domain where specialized terminology
and phrasing is used. However, the efficacy of prompt engineering in the
medical domain remains to be explored. In this work, 114 recent studies
(2022-2024) applying prompt engineering in medicine, covering prompt learning
(PL), prompt tuning (PT), and prompt design (PD) are reviewed. PD is the most
prevalent (78 articles). In 12 papers, PD, PL, and PT terms were used
interchangeably. ChatGPT is the most commonly used LLM, with seven papers using
it for processing sensitive clinical data. Chain-of-Thought emerges as the most
common prompt engineering technique. While PL and PT articles typically provide
a baseline for evaluating prompt-based approaches, 64% of PD studies lack
non-prompt-related baselines. We provide tables and figures summarizing
existing work, and reporting recommendations to guide future research
contributions.
",2024-05-02T12:52:23Z,"Jamil Zaghir, Marco Naguib, Mina Bjelogrlic, Aurélie Névéol, Xavier Tannier, Christian Lovis",http://arxiv.org/pdf/2405.01249v1
"Superhuman performance in urology board questions by an explainable
  large language model enabled for context integration of the European
  Association of Urology guidelines: the UroBot study","  Large Language Models (LLMs) are revolutionizing medical Question-Answering
(medQA) through extensive use of medical literature. However, their performance
is often hampered by outdated training data and a lack of explainability, which
limits clinical applicability. This study aimed to create and assess UroBot, a
urology-specialized chatbot, by comparing it with state-of-the-art models and
the performance of urologists on urological board questions, ensuring full
clinician-verifiability. UroBot was developed using OpenAI's GPT-3.5, GPT-4,
and GPT-4o models, employing retrieval-augmented generation (RAG) and the
latest 2023 guidelines from the European Association of Urology (EAU). The
evaluation included ten runs of 200 European Board of Urology (EBU) In-Service
Assessment (ISA) questions, with performance assessed by the mean Rate of
Correct Answers (RoCA). UroBot-4o achieved an average RoCA of 88.4%, surpassing
GPT-4o by 10.8%, with a score of 77.6%. It was also clinician-verifiable and
exhibited the highest run agreement as indicated by Fleiss' Kappa (k = 0.979).
By comparison, the average performance of urologists on board questions, as
reported in the literature, is 68.7%. UroBot's clinician-verifiable nature and
superior accuracy compared to both existing models and urologists on board
questions highlight its potential for clinical integration. The study also
provides the necessary code and instructions for further development of UroBot.
",2024-06-03T15:26:06Z,"Martin J. Hetz, Nicolas Carl, Sarah Haggenmüller, Christoph Wies, Maurice Stephan Michel, Frederik Wessels, Titus J. Brinker",http://arxiv.org/pdf/2406.01428v2
"SearchRAG: Can Search Engines Be Helpful for LLM-based Medical Question
  Answering?","  Large Language Models (LLMs) have shown remarkable capabilities in general
domains but often struggle with tasks requiring specialized knowledge.
Conventional Retrieval-Augmented Generation (RAG) techniques typically retrieve
external information from static knowledge bases, which can be outdated or
incomplete, missing fine-grained clinical details essential for accurate
medical question answering. In this work, we propose SearchRAG, a novel
framework that overcomes these limitations by leveraging real-time search
engines. Our method employs synthetic query generation to convert complex
medical questions into search-engine-friendly queries and utilizes
uncertainty-based knowledge selection to filter and incorporate the most
relevant and informative medical knowledge into the LLM's input. Experimental
results demonstrate that our method significantly improves response accuracy in
medical question answering tasks, particularly for complex questions requiring
detailed and up-to-date knowledge.
",2025-02-18T19:12:15Z,"Yucheng Shi, Tianze Yang, Canyu Chen, Quanzheng Li, Tianming Liu, Xiang Li, Ninghao Liu",http://arxiv.org/pdf/2502.13233v1
